item,type,cloze,group,sentence
1,substitution,high,1,the aquarium visitor wondered which fish the penguins had eaten during the performance.
1,substitution,low,2,the aquarium visitor wondered which trainer the penguins had eaten during the performance.
2,substitution,high,1,the storyteller explained which dragon the prince had slain with his sword.
2,substitution,low,2,the storyteller explained which princess the prince had slain with his sword.
3,substitution,high,1,the superintendent overheard which tenant the landlord had evicted at the end of May.
3,substitution,low,2,the superintendent overheard which realtor the landlord had evicted at the end of May.
4,substitution,high,1,the butler speculated which guests the master had invited to the party.
4,substitution,low,2,the butler speculated which servants the master had invited to the party.
5,substitution,high,1,the priest mentioned which nonbeliever the nun had converted on her mission trip.
5,substitution,low,2,the priest mentioned which archbishop the nun had converted on her mission trip.
6,substitution,high,1,the sheriff boasted which horse the cowboy had ridden across the town.
6,substitution,low,2,the sheriff boasted which bandit the cowboy had ridden across the town.
7,substitution,high,1,Mr. Stevens revealed which clerk the manager had fired for being lazy.
7,substitution,low,2,Mr. Stevens revealed which customer the manager had fired for being lazy.
8,substitution,high,1,the secret serviceman concealed which ex-president the agent had protected from the terrorists.
8,substitution,low,2,the secret serviceman concealed which assassin the agent had protected from the terrorists.
9,substitution,high,1,the Roman emperor asked which god the gladiator had worshipped for strength in battle.
9,substitution,low,2,the Roman emperor asked which adversary the gladiator had worshipped for strength in battle.
10,substitution,high,1,the author revealed which maiden the hero had saved from the tower.
10,substitution,low,2,the author revealed which ogre the hero had saved from the tower.
11,substitution,high,1,the columnist publicized which billionaire the supermodel had married on public television.
11,substitution,low,2,the columnist publicized which stylist the supermodel had married on public television.
12,substitution,high,1,the Iranian scholar researched which camels the Persians had ridden across the desert.
12,substitution,low,2,the Iranian scholar researched which soldiers the Persians had ridden across the desert.
13,substitution,high,1,the beggar saw which leper the saint had cured in the street.
13,substitution,low,2,the beggar saw which prophet the saint had cured in the street.
14,substitution,high,1,the historian recorded which patriot the king had knighted at the ceremony.
14,substitution,low,2,the historian recorded which traitor the king had knighted at the ceremony.
15,substitution,high,1,the monk recalled which sinner the priest had forgiven in church yesterday.
15,substitution,low,2,the monk recalled which cardinal the priest had forgiven in church yesterday.
16,substitution,high,2,the scientist noted which antelope the lion had eaten for his dinner.
16,substitution,low,1,the scientist noted which cub the lion had eaten for his dinner.
17,substitution,high,2,the secretary confirmed which illustrator the author had hired for the new book.
17,substitution,low,1,the secretary confirmed which readers the author had hired for the new book.
18,substitution,high,2,the stenographer recorded which defendant the judge had sentenced to fifteen years.
18,substitution,low,1,the stenographer recorded which lawyer the judge had sentenced to fifteen years.
19,substitution,high,2,Spencer guessed which agent the actress had hired to promote her career.
19,substitution,low,1,Spencer guessed which admirer the actress had hired to promote her career.
20,substitution,high,2,the editor listed which orphans the philanthropist had adopted from the faraway place.
20,substitution,low,1,the editor listed which volunteers the philanthropist had adopted from the faraway place.
21,substitution,high,2,the farmer remembered which pig the butcher had slaughtered in his kitchen.
21,substitution,low,1,the farmer remembered which vegetarian the butcher had slaughtered in his kitchen.
22,substitution,high,2,The homeowner asked which insects the exterminator had killed when he came over.
22,substitution,low,1,The homeowner asked which plumber the exterminator had killed when he came over.
23,substitution,high,2,the barkeeper knew which barmaids the regulars had tipped for their drinks.
23,substitution,low,1,the barkeeper knew which troublemakers the regulars had tipped for their drinks.
24,substitution,high,2,The ethnographer asked which deer the Indians had hunted with bows and arrows.
24,substitution,low,1,The ethnographer asked which babies the Indians had hunted with bows and arrows.
25,substitution,high,2,the historian knew which princess the king had married at the royal palace.
25,substitution,low,1,the historian knew which prince the king had married at the royal palace.
26,substitution,high,2,the journalist reported which opponent the politician had defeated by a wide margin.
26,substitution,low,1,the journalist reported which voters the politician had defeated by a wide margin.
27,substitution,high,2,The parent noticed which insects the child had collected in a jar.
27,substitution,low,1,The parent noticed which teacher the child had collected in a jar.
28,substitution,high,2,the scribe recorded which loyalists the monarch had rewarded for their actions.
28,substitution,low,1,the scribe recorded which rebels the monarch had rewarded for their actions.
29,substitution,high,2,the teacher remembered which delinquent the principal had suspended for a week.
29,substitution,low,1,the teacher remembered which overacheiver the principal had suspended for a week.
30,substitution,high,2,Sally heard which patient the doctor had treated first thing this morning.
30,substitution,low,1,Sally heard which nurse the doctor had treated first thing this morning.
31,substitution,high,3,the beach bum saw which fish the seagulls had caught along the beach.
31,substitution,low,4,the beach bum saw which picnickers the seagulls had caught along the beach.
32,substitution,high,3,the circus-goer explained which juggler the clown had tripped in the center ring.
32,substitution,low,4,the circus-goer explained which child the clown had tripped in the center ring.
33,substitution,high,3,the football fan heard which cheerleader the quarterback had dated after the season.
33,substitution,low,4,the football fan heard which linebacker the quarterback had dated after the season.
34,substitution,high,3,the seasonal laborer marked which cows the farmer had milked early this morning.
34,substitution,low,4,the seasonal laborer marked which chickens the farmer had milked early this morning.
35,substitution,high,3,the secretary knew which manager the CEO had promoted from the old office.
35,substitution,low,4,the secretary knew which investor the CEO had promoted from the old office.
36,substitution,high,3,General Jones heard which terrorist the corporal had captured during the battle.
36,substitution,low,4,General Jones heard which comrade the corporal had captured during the battle.
37,substitution,high,3,Jason saw which nerd the teacher had praised for his good behavior.
37,substitution,low,4,Jason saw which rascal the teacher had praised for his good behavior.
38,substitution,high,3,Jim forgot which addict the therapist had treated in his last session.
38,substitution,low,4,Jim forgot which doctor the therapist had treated in his last session.
39,substitution,high,3,the announcer stated which teammate the player had replaced for the upcoming game.
39,substitution,low,4,the announcer stated which rival the player had replaced for the upcoming game.
40,substitution,high,3,the crafts fair manager asked which cows the leatherworker had skinned to make his bags.
40,substitution,low,4,the crafts fair manager asked which customers the leatherworker had skinned to make his bags.
41,substitution,high,3,the police woman recognized which officer the lieutenant had promoted to a higher position.
41,substitution,low,4,the police woman recognized which thief the lieutenant had promoted to a higher position.
42,substitution,high,3,the reviewer forgot which researchers the authors had cited in their paper.
42,substitution,low,4,the reviewer forgot which mice the authors had cited in their paper.
43,substitution,high,3,the swim team captain recalled which champion the swimmer had defeated at last week's race.
43,substitution,low,4,the swim team captain recalled which lifeguard the swimmer had defeated at last week's race.
44,substitution,high,3,the zoologist marked which pup the seal had birthed over the weekend.
44,substitution,low,4,the zoologist marked which walrus the seal had birthed over the weekend.
45,substitution,high,3,the captain realized which stowaway the sailor had hidden in the cargo hold.
45,substitution,low,4,the captain realized which pirate the sailor had hidden in the cargo hold.
46,substitution,high,4,the father recalled which girl the boy had dated in junior high.
46,substitution,low,3,the father recalled which dog the boy had dated in junior high.
47,substitution,high,4,the Japanese scientists showed which salespeople the robots had replaced in the last decade.
47,substitution,low,3,the Japanese scientists showed which patients the robots had replaced in the last decade.
48,substitution,high,4,the principal forgot which student the teacher had disciplined after school yesterday.
48,substitution,low,3,the principal forgot which parent the teacher had disciplined after school yesterday.
49,substitution,high,4,the shepherd saw which lamb the sheep had birthed by the barn.
49,substitution,low,3,the shepherd saw which predator the sheep had birthed by the barn.
50,substitution,high,4,the snoop determined which bouncer the alcoholic had punched last Friday night.
50,substitution,low,3,the snoop determined which psychologist the alcoholic had punched last Friday night.
51,substitution,high,4,Carla inquired which exterminator the landlord had used in the apartment.
51,substitution,low,3,Carla inquired which neighbor the landlord had used in the apartment.
52,substitution,high,4,Karen learned which teenager the mother had grounded for disobeying her.
52,substitution,low,3,Karen learned which baby the mother had grounded for disobeying her.
53,substitution,high,4,Sandra observed which biologists the zookeeper had consulted about the food.
53,substitution,low,3,Sandra observed which gorillas the zookeeper had consulted about the food.
54,substitution,high,4,the anthropologist discovered which animal the caveman had hunted with flint arrows.
54,substitution,low,3,the anthropologist discovered which goddess the caveman had hunted with flint arrows.
55,substitution,high,4,the mother wondered which trick-or-treaters the neighbor had scared with his costume.
55,substitution,low,3,the mother wondered which milkman the neighbor had scared with his costume.
56,substitution,high,4,the movie buff speculated which actor the stuntman had portrayed in the opening scene.
56,substitution,low,3,the movie buff speculated which director the stuntman had portrayed in the opening scene.
57,substitution,high,4,the researcher recorded which chimpanzee the biologist had tagged to be studied.
57,substitution,low,3,the researcher recorded which assistant the biologist had tagged to be studied.
58,substitution,high,4,the sentry knew which guard the captain had fired from the position.
58,substitution,low,3,the sentry knew which townsperson the captain had fired from the position.
59,substitution,high,4,the team manager knew which athlete the officials had penalized for being unsportsmanlike.
59,substitution,low,3,the team manager knew which umpire the officials had penalized for being unsportsmanlike.
60,substitution,high,4,the theater owner described which spectators the magician had amazed with his tricks.
60,substitution,low,3,the theater owner described which rabbit the magician had amazed with his tricks.
61,reversal,high,1,The librarian documented which celebrities the journalist had interviewed for the magazine.
61,reversal,low,2,The librarian documented which journalist the celebrities had interviewed for the magazine.
62,reversal,high,1,the old widower remembered which villager the ghost had haunted for many years.
62,reversal,low,2,the old widower remembered which ghost the villager had haunted for many years.
63,reversal,high,1,the firefighter reported which victim the paramedic had saved after the fire.
63,reversal,low,2,the firefighter reported which paramedic the victim had saved after the fire.
64,reversal,high,1,the historian documented which prince the assassin had killed in the 10th century.
64,reversal,low,2,the historian documented which assassin the prince had killed in the 10th century.
65,reversal,high,1,the park ranger documented which eagle the hunter had shot with a rifle.
65,reversal,low,2,the park ranger documented which hunter the eagle had shot with a rifle.
66,reversal,high,1,the judo master recognized which defender the assailant had attacked late last night.
66,reversal,low,2,the judo master recognized which assailant the defender had attacked late last night.
67,reversal,high,1,the naturalist observed which predators the deer had avoided by sleeping in the daytime.
67,reversal,low,2,the naturalist observed which deer the predators had avoided by sleeping in the daytime.
68,reversal,high,1,the restaurant owner forgot which customer the waitress had served during dinner yesterday.
68,reversal,low,2,the restaurant owner forgot which waitress the customer had served during dinner yesterday.
69,reversal,high,1,the head nun explained which friar the temptress had seduced after Sunday mass.
69,reversal,low,2,the head nun explained which temptress the friar had seduced after Sunday mass.
70,reversal,high,1,the housekeeper showed which mouse the cat had killed under the table.
70,reversal,low,2,the housekeeper showed which cat the mouse had killed under the table.
71,reversal,high,1,the nanny knew which housekeeper the billionaire had hired from their conversation.
71,reversal,low,2,the nanny knew which billionaire the housekeeper had hired from their conversation.
72,reversal,high,1,the researcher learned which whale the biologist had studied in the lab.
72,reversal,low,2,the researcher learned which biologist the whale had studied in the lab.
73,reversal,high,1,Tracy announced which applicant the administrator had chosen after the interview.
73,reversal,low,2,Tracy announced which administrator the applicant had chosen after the interview.
74,reversal,high,1,the birthday boy saw which friend the clown had scared at the party.
74,reversal,low,2,the birthday boy saw which clown the friend had scared at the party.
75,reversal,high,1,the columnist publicized which photographer the celebrity had punched in the nose.
75,reversal,low,2,the columnist publicized which celebrity the photographer had punched in the nose.
76,reversal,high,2,the documentarian showed which piglets the agriculturalist had raised at the farm.
76,reversal,low,1,the documentarian showed which agriculturalist the piglets had raised at the farm.
77,reversal,high,2,the police officer noted which jeweler the burglar had robbed on his spree.
77,reversal,low,1,the police officer noted which burglar the jeweler had robbed on his spree.
78,reversal,high,2,the royal cook asked which lord the chef had served for twenty years.
78,reversal,low,1,the royal cook asked which chef the lord had served for twenty years.
79,reversal,high,2,the trapeze artist indicated which lion the trainer had tamed for the circus.
79,reversal,low,1,the trapeze artist indicated which trainer the lion had tamed for the circus.
80,reversal,high,2,the wildlife curator mentioned which ape the zookeeper had fed some fresh fruit.
80,reversal,low,1,the wildlife curator mentioned which zookeeper the ape had fed some fresh fruit.
81,reversal,high,2,the aid worker realized which refugees the philanthropist had helped to escape starvation.
81,reversal,low,1,the aid worker realized which philanthropist the refugees had helped to escape starvation.
82,reversal,high,2,the camper reported which girl the bear had mauled in the forest.
82,reversal,low,1,the camper reported which bear the girl had mauled in the forest.
83,reversal,high,2,the dance instructor noticed which onlookers the performers had impressed in the audience.
83,reversal,low,1,the dance instructor noticed which performers the onlookers had impressed in the audience.
84,reversal,high,2,the high schooler heard which geek the jock had bullied in the hall.
84,reversal,low,1,the high schooler heard which jock the geek had bullied in the hall.
85,reversal,high,2,The parent saw which child the lifeguard had rescued from the pool.
85,reversal,low,1,The parent saw which lifeguard the child had rescued from the pool.
86,reversal,high,2,the ringmaster recognized which cheetah the tamer had trained three years ago.
86,reversal,low,1,the ringmaster recognized which tamer the cheetah had trained three years ago.
87,reversal,high,2,the travel agent recorded which innkeeper the guests had liked in his notebook.
87,reversal,low,1,the travel agent recorded which guests the innkeeper had liked in his notebook.
88,reversal,high,2,the bird watcher saw which photographer the hawk had attacked in the woods.
88,reversal,low,1,the bird watcher saw which hawk the photographer had attacked in the woods.
89,reversal,high,2,the costume designer confirmed which actor the barber had shaved for the part.
89,reversal,low,1,the costume designer confirmed which barber the actor had shaved for the part.
90,reversal,high,2,The Indian king identified which prince the elephant had trampled during the long journey.
90,reversal,low,1,The Indian king identified which elephant the prince had trampled during the long journey.
91,reversal,high,3,the investigator discovered which couple the abductor had taken during their vacation.
91,reversal,low,4,the investigator discovered which abductor the couple had taken during their vacation.
92,reversal,high,3,the jail keeper forgot which guard the prisoner had attacked in his cell.
92,reversal,low,4,the jail keeper forgot which prisoner the guard had attacked in his cell.
93,reversal,high,3,the sailor saw which whale the man had harpooned on the starboard side.
93,reversal,low,4,the sailor saw which man the whale had harpooned on the starboard side.
94,reversal,high,3,the sheriff recalled which locals the gangsters had robbed in a dark alleyway.
94,reversal,low,4,the sheriff recalled which gangsters the locals had robbed in a dark alleyway.
95,reversal,high,3,the undead king recognized which woman the zombie had bitten during the fight.
95,reversal,low,4,the undead king recognized which zombie the woman had bitten during the fight.
96,reversal,high,3,Tonia explained which housewife the conman had swindled over the phone.
96,reversal,low,4,Tonia explained which conman the housewife had swindled over the phone.
97,reversal,high,3,the broadcaster explained which contestant the judge had disqualified from the show.
97,reversal,low,4,the broadcaster explained which judge the contestant had disqualified from the show.
98,reversal,high,3,the campaign volunteer speculated which mayor the voters had elected by a landslide.
98,reversal,low,4,the campaign volunteer speculated which voters the mayor had elected by a landslide.
99,reversal,high,3,the family counselor understood which daughter the stepparent had abused on a daily basis.
99,reversal,low,4,the family counselor understood which stepparent the daughter had abused on a daily basis.
100,reversal,high,3,the newscaster confirmed which fugitive the policeman had arrested following the robbery.
100,reversal,low,4,the newscaster confirmed which policeman the fugitive had arrested following the robbery.
101,reversal,high,3,the opera composer revealed which pirate the singer had portrayed with the greatest finesse.
101,reversal,low,4,the opera composer revealed which singer the pirate had portrayed with the greatest finesse.
102,reversal,high,3,the prison warden guessed which jailer the inmate had stabbed with a knife.
102,reversal,low,4,the prison warden guessed which inmate the jailer had stabbed with a knife.
103,reversal,high,3,the producer observed which viewers the acrobats had impressed with their tricks.
103,reversal,low,4,the producer observed which acrobats the viewers had impressed with their tricks.
104,reversal,high,3,the queen recognized which nobleman the comedian had entertained with his jokes.
104,reversal,low,4,the queen recognized which comedian the nobleman had entertained with his jokes.
105,reversal,high,3,the reporter inquired which animals the groomer had cleaned with special shampoo.
105,reversal,low,4,the reporter inquired which groomer the animals had cleaned with special shampoo.
106,reversal,high,4,The ape researcher identified which chimpanzee the poacher had shot in the jungle.
106,reversal,low,3,The ape researcher identified which poacher the chimpanzee had shot in the jungle.
107,reversal,high,4,the boatman saw which shark the diver had speared just off the shore.
107,reversal,low,3,the boatman saw which diver the shark had speared just off the shore.
108,reversal,high,4,the committee member guessed which advisors the president had appointed to the Cabinet.
108,reversal,low,3,the committee member guessed which president the advisors had appointed to the Cabinet.
109,reversal,high,4,the farmer indicated which donkey the townsperson had bought in the neighboring village.
109,reversal,low,3,the farmer indicated which townsperson the donkey had bought in the neighboring village.
110,reversal,high,4,the military man knew which soldiers the general had promoted after their tour.
110,reversal,low,3,the military man knew which general the soldiers had promoted after their tour.
111,reversal,high,4,the parole officer confirmed which delinquent the psychologist had treated several times already.
111,reversal,low,3,the parole officer confirmed which psychologist the delinquent had treated several times already.
112,reversal,high,4,the policeman knew which suspect the detective had arrested for the recent crime.
112,reversal,low,3,the policeman knew which detective the suspect had arrested for the recent crime.
113,reversal,high,4,the priest knew which demon the exorcist had expelled with a cross.
113,reversal,low,3,the priest knew which exorcist the demon had expelled with a cross.
114,reversal,high,4,Jack observed which passenger the conductor had removed from the train.
114,reversal,low,3,Jack observed which conductor the passenger had removed from the train.
115,reversal,high,4,Teresa knew which neighbor the parrot had bitten at the block party.
115,reversal,low,3,Teresa knew which parrot the neighbor had bitten at the block party.
116,reversal,high,4,the art critic identified which model the artist had drawn in the studio.
116,reversal,low,3,the art critic identified which artist the model had drawn in the studio.
117,reversal,high,4,The cotton farmer wondered which master the slave had escaped by running through the woods.
117,reversal,low,3,The cotton farmer wondered which slave the master had escaped by running through the woods.
118,reversal,high,4,the farmhand recorded which goats the breeder had sold at the market.
118,reversal,low,3,the farmhand recorded which breeder the goats had sold at the market.
119,reversal,high,4,the four-year-old knew which hero the dragon had eaten for dinner last night.
119,reversal,low,3,the four-year-old knew which dragon the hero had eaten for dinner last night.
120,reversal,high,4,the security guard investigated which patrolman the loiterer had evaded for three hours.
120,reversal,low,3,the security guard investigated which loiterer the patrolman had evaded for three hours.
1,diff,high,11,The tenant inquired which neighbor the landlord had evicted from the apartment complex.
2,diff,high,11,The tenant inquired which exterminator the landlord had hired for the job.
3,diff,high,11,The general heard which terrorist the corporal had captured during the stakeout.
4,diff,high,11,The general heard which comrade the corporal had promoted in the army.
5,diff,high,11,The vice principal saw which rascal the teacher had punished with a detention note.
6,diff,high,11,The vice principal saw which nerd the teacher had praised in the classroom.
7,diff,high,11,The journalist wrote which foodie the chef had served at the restaurant.
8,diff,high,11,The journalist wrote which waiter the chef had yelled at for being incompetent.
9,diff,high,11,The secretary forgot which addict the therapist had treated at the clinic.
10,diff,high,11,The secretary forgot which doctor the therapist had recommended for him to go to.
11,diff,high,11,The babysitter learned which baby the mother had adopted several weeks ago.
12,diff,high,11,The babysitter learned which teenager the mother had punished for being late.
13,diff,high,11,The executive revealed which clerk the manager had promoted to a higher position.
14,diff,high,11,The administrator heard which patient the doctor had treated in the hospital room.
15,diff,high,11,The administrator heard which nurse the doctor had hired to assist him.
16,diff,high,11,The author revealed which ogre the hero had slain in the cave.
17,diff,high,11,The author revealed which maiden the hero had rescued after the fight.
