item,type,cloze,group,sentence
111,same,high,13,The footballer learned which fan the referee had yelled at during the time-out.
112,same,high,13,The child stated which pediatrician  the nurse had recommended to regularily see.
113,same,high,13,The advisor recognized which pupil the tutor had taught math weekly to.
114,same,high,13,The model guessed which techie the photographer had hired for the shoot.
115,same,high,13,The victim deduced which hooligan the guard had detained during the fight.
116,same,high,13,The voter reported which politician the activist had supported during the elections.
117,same,high,13,The pedestrian saw which panhandler the shopkeeper had caught trying to steal.
118,same,high,13,The arsonist knew which firefighter the mayor had awarded a medal to.
119,same,high,13,The client knew which engineer the boss had promoted earlier that week.
120,same,high,13,The producer learned which actor the director had cast for the role.
31,diff,low,13,The journalist reported which voters the politician had defeated in the election.
32,diff,low,13,The journalist reported which opponent the politician had bribed with his money.
33,diff,low,13,The paleoanthropologist discovered which animal the caveman had worshipped with his murals.
34,diff,low,13,The paleoanthropologist discovered which goddess the caveman had eaten during the winter.
35,diff,low,13,The reporter publicized which entrepreneur the millionaire had married the previous week.
36,diff,low,13,The reporter publicized which golddigger the millionaire had invested in for the fiscal year.
37,diff,low,13,The secret serviceman concealed which ex-president the agent had shot in the chest.
38,diff,low,13,The secret serviceman concealed which assassin the agent had protected from the bullet.
39,diff,low,13,The storyteller explained which dragon the prince had saved with his bravery.
40,diff,low,13,The storyteller explained which princess the prince had slain with his sword.
41,diff,low,13,The swim team recalled which lifeguard the swimmer had beaten during the race.
42,diff,low,13,The swim team recalled which champion the swimmer had saved by giving CPR.
43,diff,low,13,The teacher remembered which overacheiver the principal had punished after the scuffle.
44,diff,low,13,The teacher remembered which delinquent the principal had praised for good grades.
45,diff,low,13,The team manager knew which umpire the officials had penalized during the match.
46,diff,low,13,The team manager knew which athlete the officials had selected to be at the game.
47,diff,low,13,The pharmacist realized which specialist the physician had helped in the examination room.
48,diff,low,13,The pharmacist realized which customer the physician had recommended for further analysis.
49,diff,low,13,The woman understood which addict the psychiatrist had recommended to take a visit to.
50,diff,low,13,The woman understood which pharmacist the psychiatrist had treated for several months.
51,diff,low,13,The reporter mentioned which skeptic the psychic had read the future for.
52,diff,low,13,The reporter mentioned which believer the psychic had convinced with her act.
53,diff,low,13,The editor knew which tribesman the anthropologist had used for the expedition.
54,diff,low,13,The editor knew which cameraman the anthropologist had studied for the last year.
55,diff,low,13,The intern heard which patient the dentist had recommended for a follow-up.
56,diff,low,13,The intern heard which surgeon the dentist had injured during the check-up.
57,diff,low,13,The king saw which villain the superhero had saved from the fire.
58,diff,low,13,The king saw which damsel the superhero had defeated in the battle.
59,diff,low,13,The principal observed which troublemaker the teacher had praised for good work.
60,diff,low,13,The principal  observed which perfectionist the teacher had punished for starting a fight.
1,same,low,13,The neighbor inquired which exterminator the landlord had evicted from the apartment complex.
2,same,low,13,The exterminator inquired which neighbor the landlord had hired for the job.
3,same,low,13,The terrorist heard which comrade the corporal had captured during the stakeout.
4,same,low,13,The comrade heard which terrorist the corporal had promoted in the army.
5,same,low,13,The rascal saw which nerd the teacher had punished with a detention note.
6,same,low,13,The nerd saw which rascal the teacher had praised in the classroom.
7,same,low,13,The foodie wrote which waiter the chef had served at the restaurant.
8,same,low,13,The waiter wrote which foodie the chef had yelled at for being incompetent.
9,same,low,13,The addict forgot which doctor the therapist had treated at the clinic.
10,same,low,13,The doctor forgot which addict the therapist had recommended for him to go to.
11,same,low,13,The baby learned which teenager the mother had adopted several weeks ago.
12,same,low,13,The teenager learned which baby the mother had punished for being late.
13,same,low,13,The clerk revealed which customer the manager had promoted to a higher position.
14,same,low,13,The patient heard which nurse the doctor had treated in the hospital room.
15,same,low,13,The nurse heard which patient the doctor had hired to assist him.
16,same,low,13,The ogre  revealed which maiden the hero had slain in the cave.
17,same,low,13,The maiden revealed which ogre the hero had rescued after the fight.
18,same,low,13,The troublemakers knew which barmaids the regulars had fought after getting drunk.
19,same,low,13,The barmaids knew which troublemakers the regulars had tipped extra money to.
20,same,low,13,The libelist  overheard which clerk the executive had sued at the court.
21,same,low,13,The clerk overheard which libelist the executive had promoted in the company.
22,same,low,13,The guests speculated which servants the master had invited to his manor.
23,same,low,13,The servants speculated which guests the master had fired from the job.
24,same,low,13,The sidekick announced which villain the superhero had chosen as his partner.
25,same,low,13,The cheater stated which proctor the professor had caught during the exam.
26,same,low,13,The proctor stated which cheater the professor had used for the final test.
27,same,low,13,The hooligan deduced which victim the gangster had recruited for the assignment.
28,same,low,13,The victim deduced which hooligan the gangster had robbed in the alleyway.
29,same,low,13,The demons described which newts the sorceress had summoned with her spell.
30,same,low,13,The newts described which demons the sorceress had used in the potion.
91,diff,high,14,The investigator confirmed which gunman the criminal had hired during the heist.
92,diff,high,14,The manager guessed which client the technician had helped earlier that day.
93,diff,high,14,The monk recalled which sinner the priest had forgiven during the morning mass.
94,diff,high,14,The movie buff speculated which actor the stuntman had replaced in the movie shot.
95,diff,high,14,The police woman recognized which lieutenant the officer had promoted to a higher rank.
96,diff,high,14,The politician forgot which voter the senator had bribed to help him win.
97,diff,high,14,The priest mentioned which nonbeliever the nun had converted at the church.
98,diff,high,14,The priestess named which warrior the deity had blessed during the prayer ceremony.
99,diff,high,14,The principal forgot which parent the teacher had called to meet with.
100,diff,high,14,The reviewer criticized which researchers the authors had cited in their paper.
101,diff,high,14,The Roman asked which god the gladiator had prayed to before the battle.
102,diff,high,14,The screenwriter clarified which viewers the director had targeted with his movie.
103,diff,high,14,The scribe recorded which loyalists the monarch had rewarded with a casket of jewels.
104,diff,high,14,The secretary confirmed which illustrator the author had used for her book.
105,diff,high,14,The secretary knew which manager the CEO had promoted in his company.
106,diff,high,14,The sentry knew which guard the captain had promoted to a more important position.
107,diff,high,14,The snoop determined which bouncher the alcoholic had hit during a drunken rage.
108,diff,high,14,The spectator remembered which batter the catcher had tagged out during the first half.
109,diff,high,14,The stenographer recorded which defendant the judge had sentenced in the trial.
110,diff,high,14,The woman indicated which bicyclist the driver had struck with his car.
111,diff,high,14,The coach learned which fan the referee had yelled at during the time-out.
112,diff,high,14,The mother stated which pediatrician  the nurse had recommended to regularily see.
113,diff,high,14,The administrator recognized which pupil the tutor had taught math weekly to.
114,diff,high,14,The fashion designer  guessed which techie the photographer had hired for the shoot.
115,diff,high,14,The deputy deduced which hooligan the guard had detained during the fight.
116,diff,high,14,The journalist reported which politician the activist had supported during the elections.
117,diff,high,14,The street vendor saw which panhandler the shopkeeper had caught trying to steal.
118,diff,high,14,The journalist knew which firefighter the mayor had awarded a medal to.
119,diff,high,14,The assistant knew which engineer the boss had promoted earlier that week.
120,diff,high,14,The movie buff learned which actor the director had cast for the role.
61,same,high,14,The bartender saw which patron the owner had served a beer to.
62,same,high,14,The patron saw which bartender the owner had fired from the position.
63,same,high,14,The gambler knew which jockey the horse had thrown during the tourney.
64,same,high,14,The administrator knew which dentist the kid had visited the previous day.
65,same,high,14,The villager asked which pickpocket the tourist had caught trying to steal.
66,same,high,14,The activist knew which boss the striker had targeted during the riot.
67,same,high,14,The blogger explained which artists the DJ had played at the club.
68,same,high,14,The lecturer guessed which freshman the TA had dated the previous semester.
69,same,high,14,The announcer stated which wrestler the referee had disqualified from the match.
70,same,high,14,The diplomat stated which prisoner the guard had beaten in the jailhouse.
71,same,high,14,The clerk revealed which customer the manager had helped on the phone.
72,same,high,14,The informant overheard which criminal the police had caught during the bust.
73,same,high,14,The go-getter heard which slacker the boss had fired for being lazy.
74,same,high,14,The tourist observed which biologist the zookeeper had hired for the exhibit.
75,same,high,14,The customer guessed which employee the manager had fired for missing work.
76,same,high,14,The admirer surmised which agent the actress had hired for the audition.
77,same,high,14,The supporter reported which candidate the senator had defeated in the last election.
78,same,high,14,The teammate stated which rival the player had defeated during the game.
79,same,high,14,The applicant  verified which worker the employer had fired the previous month.
80,same,high,14,The prophet saw which leper the wiseman had cured with his healing.
81,same,high,14,The landlubber realized which stowaway the sailor had hidden in the cargo area.
82,same,high,14,The juggler explained which child the clown had scared with his trick.
83,same,high,14,The billionaire publicized which stylist the supermodel had used for the fashion show.
84,same,high,14,The spectators reported which contestants the judges had chosen for the game show.
85,same,high,14,The volunteer published which orphan the philanthropist had adopted at a young age.
86,same,high,14,The linebacker heard which cheerleader the quarterback had dated during the semester.
87,same,high,14,The supporter  knew which activist the dictator had imprisoned during the trials.
88,same,high,14,The prince knew which queen the king had married in the palace.
89,same,high,14,The traitor recorded which patriot the king had knighted during the ceremony.
90,same,high,14,The rebel learned which mercenaries the emperor had employed to work for him.
1,diff,low,14,The tenant inquired which exterminator the landlord had evicted from the apartment complex.
2,diff,low,14,The tenant inquired which neighbor the landlord had hired for the job.
3,diff,low,14,The general heard which comrade the corporal had captured during the stakeout.
4,diff,low,14,The general heard which terrorist the corporal had promoted in the army.
5,diff,low,14,The vice principal saw which nerd the teacher had punished with a detention note.
6,diff,low,14,The vice principal saw which rascal the teacher had praised in the classroom.
7,diff,low,14,The journalist wrote which waiter the chef had served at the restaurant.
8,diff,low,14,The journalist wrote which foodie the chef had yelled at for being incompetent.
9,diff,low,14,The secretary forgot which doctor the therapist had treated at the clinic.
10,diff,low,14,The secretary forgot which addict the therapist had recommended for him to go to.
11,diff,low,14,The babysitter learned which teenager the mother had adopted several weeks ago.
12,diff,low,14,The babysitter learned which baby the mother had punished for being late.
13,diff,low,14,The executive revealed which customer the manager had promoted to a higher position.
14,diff,low,14,The administrator heard which nurse the doctor had treated in the hospital room.
15,diff,low,14,The administrator heard which patient the doctor had hired to assist him.
16,diff,low,14,The author revealed which maiden the hero had slain in the cave.
17,diff,low,14,The author revealed which ogre the hero had rescued after the fight.
18,diff,low,14,The bartender knew which barmaids the regulars had fought after getting drunk.
19,diff,low,14,The bartender knew which troublemakers the regulars had tipped extra money to.
20,diff,low,14,The businessman overheard which clerk the executive had sued at the court.
21,diff,low,14,The businessman overheard which libelist the executive had promoted in the company.
22,diff,low,14,The butler speculated which servants the master had invited to his manor.
23,diff,low,14,The butler speculated which guests the master had fired from the job.
24,diff,low,14,The comic book artist announced which villain the superhero had chosen as his partner.
25,diff,low,14,The department chair stated which proctor the professor had caught during the exam.
26,diff,low,14,The department chair stated which cheater the professor had used for the final test.
27,diff,low,14,The deputy deduced which victim the gangster had recruited for the assignment.
28,diff,low,14,The deputy deduced which hooligan the gangster had robbed in the alleyway.
29,diff,low,14,The fairy princess described which newts the sorceress had summoned with her spell.
30,diff,low,14,The fairy princess described which demons the sorceress had used in the potion.
31,same,low,14,The opponent reported which voters the politician had defeated in the election.
32,same,low,14,The voters reported which opponent the politician had bribed with his money.
33,same,low,14,The goddess discovered which animal the caveman had worshipped with his murals.
34,same,low,14,The animal discovered which goddess the caveman had eaten during the winter.
35,same,low,14,The golddigger publicized which entrepreneur the millionaire had married the previous week.
36,same,low,14,The entrepreneur publicized which golddigger the millionaire had invested in for the fiscal year.
37,same,low,14,The assassin concealed which ex-president the agent had shot in the chest.
38,same,low,14,The ex-president concealed which assassin the agent had protected from the bullet.
39,same,low,14,The princess explained which dragon the prince had saved with his bravery.
40,same,low,14,The dragon explained which princess the prince had slain with his sword.
41,same,low,14,The champion recalled which lifeguard the swimmer had beaten during the race.
42,same,low,14,The lifeguard recalled which champion the swimmer had saved by giving CPR.
43,same,low,14,The delinquent remembered which overacheiver the principal had punished after the scuffle.
44,same,low,14,The overacheiver remembered which delinquent the principal had praised for good grades.
45,same,low,14,The athlete knew which umpire the officials had penalized during the match.
46,same,low,14,The umpire knew which athlete the officials had selected to be at the game.
47,same,low,14,The customer realized which specialist the physician had helped in the examination room.
48,same,low,14,The specialist realized which customer the physician had recommended for further analysis.
49,same,low,14,The pharmicist understood which addict the psychiatrist had recommended to take a visit to.
50,same,low,14,The addict understood which pharmacist the psychiatrist had treated for several months.
51,same,low,14,The believer mentioned which skeptic the psychic had read the future for.
52,same,low,14,The skeptic mentioned which believer the psychic had convinced with her act.
53,same,low,14,The cameraman knew which tribesman the anthropologist had used for the expedition.
54,same,low,14,The tribesman knew which cameraman the anthropologist had studied for the last year.
55,same,low,14,The surgeon heard which patient the dentist had recommended for a follow-up.
56,same,low,14,The patient heard which surgeon the dentist had injured during the check-up.
57,same,low,14,The damsel saw which villain the superhero had saved from the fire.
58,same,low,14,The villain saw which damsel the superhero had defeated in the battle.
59,same,low,14,The perfectionist observed which troublemaker the teacher had praised for good work.
60,same,low,14,The troublemaker observed which perfectionist the teacher had punished for starting a fight.